{
  "$schema": "https://json-schema.org/draft/2020-12/schema",
  "$id": "https://local.invalid/drawio-builder/artifact-manifest.schema.json",
  "title": "Draw.io Artifact Manifest",
  "type": "object",
  "additionalProperties": false,
  "required": ["schemaVersion", "page", "renderer", "delivery", "artifacts"],
  "properties": {
    "schemaVersion": { "const": 2 },
    "page": {
      "type": "object",
      "additionalProperties": false,
      "required": ["id", "width", "height"],
      "properties": {
        "id": { "type": "string", "minLength": 1 },
        "width": { "type": "number", "exclusiveMinimum": 0 },
        "height": { "type": "number", "exclusiveMinimum": 0 }
      }
    },
    "renderer": {
      "type": "object",
      "additionalProperties": false,
      "required": ["name", "version"],
      "properties": {
        "name": { "type": "string", "minLength": 1 },
        "version": { "type": "string", "minLength": 1 }
      }
    },
    "delivery": {
      "type": "object",
      "additionalProperties": false,
      "required": ["frameWidthMm", "frameHeightMm", "densityPpi", "minimumEffectiveFontPoints", "cropBorder"],
      "properties": {
        "frameWidthMm": { "type": "number", "exclusiveMinimum": 0 },
        "frameHeightMm": { "type": "number", "exclusiveMinimum": 0 },
        "densityPpi": { "type": "integer", "minimum": 72 },
        "minimumEffectiveFontPoints": { "type": "number", "exclusiveMinimum": 0 },
        "cropBorder": { "type": "number", "minimum": 0 }
      }
    },
    "artifacts": {
      "type": "array",
      "minItems": 2,
      "items": {
        "type": "object",
        "additionalProperties": false,
        "required": ["role", "path", "sha256"],
        "properties": {
          "role": { "enum": ["canonical", "wrapper", "svg", "png", "word-png", "pdf"] },
          "path": { "type": "string", "minLength": 1 },
          "sha256": { "type": "string", "pattern": "^[A-Fa-f0-9]{64}$" }
        }
      }
    }
  }
}
